"Sort Key","Type","Name","Version","Name Space Id","Description","Steward","Value Type","Minimum Cardinality","Maximum Cardinality","Minimum Value","Maximum Value","Minimum Characters","Maximum Characters","Unit of Measure Type","Specified Unit Id","Attribute Concept","Conceptual Domain"
"img:Imaging:1                       ","Class","Imaging","1.0.0.0","img","The Imaging class contains classes and attributes describing both the image product itself and the imaging instrument. Image product information can include exposure duration, filters, data correction, sampling, frame, sub-frames, and how the product was derived. For the imaging instrument, information can be provided describing the dynamic physical or operating characteristics of the imaging instrument.","img","","","","","","","","","","",""
"img:Autoexposure:1                  ","Class","Autoexposure","1.0.0.0","img","The Autoexposure class contains attributes used to identify or describe the algorithm used to automatically calculate the proper exposure time. This is generally based on some kind of histogram analysis. The specific autoexposure algorithm used is defined in the processing_algorithm attribute, and the specific set of attributes needed to describe it will vary based on the algorithm. Examples of autoexposure algorithms include "Maki 2003" used on MER, MSL ECAMs, M2020 ECAMS; "Maurice 2012" used on MSL ChemCam; "Smith 1997" used on Mars Pathfinder Imager.","img","","","","","","","","","","",""
"img:Autoexposure:2                   img:auto_exposure_data_cut:1        ","Attribute","auto_exposure_data_cut","n/a","img","The auto_exposure_data_cut attribute specifies the DN value which a specified fraction of pixels is permitted to exceed. The fraction is specified using the auto_exposure_data_fraction attribute.","img","ASCII_Integer","0","1","-9223372036854775808","9223372036854775807","Unbounded","Unbounded","Units_of_None","none","TBD_classConcept","INTEGER"
"img:Autoexposure:2                   img:auto_exposure_percent:1         ","Attribute","auto_exposure_percent","n/a","img","The auto_exposure_percent attribute specifies the auto-exposure early-termination percent. If the desired DN (auto_exposure_data_cut) is within this percentage of the measured DN (the DN at which the percentage of pixels above that DN equals or exceeds the auto_exposure_pixel_fraction), then the auto exposure algorithm is terminated and the calculated time is accepted.","img","ASCII_Real","0","1","-1.7976931348623157e308","1.7976931348623157e308","Unbounded","Unbounded","Units_of_None","none","TBD_classConcept","REAL"
"img:Autoexposure:2                   img:auto_exposure_pixel_fraction:1  ","Attribute","auto_exposure_pixel_fraction","n/a","img","The auto_exposure_pixel_fraction attribute specifies the percentage of pixels whose DN values may exceed the auto_expsoure_data_cut.","img","ASCII_Real","0","1","-1.7976931348623157e308","1.7976931348623157e308","Unbounded","Unbounded","Units_of_None","none","TBD_classConcept","REAL"
"img:Autoexposure:2                   img:auto_exposure_lower_threshold:1 ","Attribute","auto_exposure_lower_threshold","n/a","img","Specifies the lower threshold DN value for which a specified number of pixels is permitted to exceed. The auto_exposure_lower_limit defines the number of pixels allowed to exceed this threshold.","img","ASCII_Integer","0","1","-9223372036854775808","9223372036854775807","Unbounded","Unbounded","Units_of_None","none","TBD_classConcept","INTEGER"
"img:Autoexposure:2                   img:auto_exposure_lower_limit:1     ","Attribute","auto_exposure_lower_limit","n/a","img","Specifies the maximum number of pixels that are allowed to be below the lower threshold defined by auto_exposure_lower_limit.","img","ASCII_NonNegative_Integer","0","1","0","18446744073709551615","Unbounded","Unbounded","Units_of_None","none","TBD_classConcept","INTEGER"
"img:Autoexposure:2                   img:auto_exposure_upper_threshold:1 ","Attribute","auto_exposure_upper_threshold","n/a","img","Specifies the upper threshold DN value for which a specified number of pixels is permitted to exceed. The auto_exposure_upper_limit defines the number of pixels allowed to exceed this threshold.","img","ASCII_Integer","0","1","-9223372036854775808","9223372036854775807","Unbounded","Unbounded","Units_of_None","none","TBD_classConcept","INTEGER"
"img:Autoexposure:2                   img:auto_exposure_upper_limit:1     ","Attribute","auto_exposure_upper_limit","n/a","img","Specifies the maximum number of pixels that are allowed to be above the upper threshold defined by auto_exposure_upper_limit.","img","ASCII_NonNegative_Integer","0","1","0","18446744073709551615","Unbounded","Unbounded","Units_of_None","none","TBD_classConcept","INTEGER"
"img:Autoexposure:2                   img:auto_exposure_roi_lines:1       ","Attribute","auto_exposure_roi_lines","n/a","img","Specifies the number of lines in the autoexposure region of interest.","img","ASCII_NonNegative_Integer","0","1","0","18446744073709551615","Unbounded","Unbounded","Units_of_None","none","TBD_classConcept","INTEGER"
"img:Autoexposure:2                   img:auto_exposure_roi_samples:1     ","Attribute","auto_exposure_roi_samples","n/a","img","Specifies the number of samples in the autoexposure region of interest.","img","ASCII_NonNegative_Integer","0","1","0","18446744073709551615","Unbounded","Unbounded","Units_of_None","none","TBD_classConcept","INTEGER"
"img:Autoexposure:2                   img:auto_exposure_roi_first_line:1  ","Attribute","auto_exposure_roi_first_line","n/a","img","Specifies the (1-based) starting line for the autoexposure region of interest.","img","ASCII_NonNegative_Integer","0","1","0","18446744073709551615","Unbounded","Unbounded","Units_of_None","none","TBD_classConcept","INTEGER"
"img:Autoexposure:2                   img:auto_exposure_roi_first_sample:1","Attribute","auto_exposure_roi_first_sample","n/a","img","Specifies the (1-based) starting sample for the autoexposure region of interest.","img","ASCII_NonNegative_Integer","0","1","0","18446744073709551615","Unbounded","Unbounded","Units_of_None","none","TBD_classConcept","INTEGER"
"img:Autoexposure:2                   img:max_auto_exposure_iteration_count:1","Attribute","max_auto_exposure_iteration_count","n/a","img","The max_auto_exposure_iteration_count attribute specifies the maximum number of exposure iterations the instrument will perform in order to obtain the requested exposure.","img","ASCII_Integer","0","1","-9223372036854775808","9223372036854775807","Unbounded","Unbounded","Units_of_None","none","TBD_classConcept","INTEGER"
"img:Autoexposure:2                   img:exposure_table:1                ","Attribute","exposure_table","n/a","img","Identifies the exposure table to be used, or that was used. The exposure table provides the seed exposure value to use for each camera for the autoexposure algorithm.","img","ASCII_Short_String_Collapsed","0","1","Unbounded","Unbounded","1","255","Units_of_None","none","TBD_classConcept","SHORT_STRING"
"img:Autoexposure:2                   img:exposure_table_update_flag:1    ","Attribute","exposure_table_update_flag","n/a","img","If true, specifies whether or not to update the autoexposure table based on the results of this exposure.","img","ASCII_Boolean","0","1","Unbounded","Unbounded","Unbounded","Unbounded","Units_of_None","none","TBD_classConcept","BOOLEAN"
"img:Autoexposure:2                   img:valid_minimum_pixel:1           ","Attribute","valid_minimum_pixel","n/a","img","Specifies the minimum DN threshold for pixels used by the autoexposure algorithm.","img","ASCII_Integer","0","1","-9223372036854775808","9223372036854775807","Unbounded","Unbounded","Units_of_None","none","TBD_classConcept","INTEGER"
"img:Autoexposure:2                   img:valid_maximum_pixel:1           ","Attribute","valid_maximum_pixel","n/a","img","Specifies the maximum pixel DN value for pixels used by the autoexposure algorithm.","img","ASCII_Integer","0","1","-9223372036854775808","9223372036854775807","Unbounded","Unbounded","Units_of_None","none","TBD_classConcept","INTEGER"
"img:Autoexposure:2                   img:active_flag:1                   ","Attribute","active_flag","n/a","img","The active_flag attribute indicates whether or not the data processing described by the parent class is active. In general, the presence of the parent class implies it is active and thus active_flag is optional. The primary purpose for active_flag is to either explicitly indicate a correction is not active (for example, if it normally is but was explicitly turned off), or to be able to provide parameters for historical reasons that may no longer be relevant to a current correction. ","img","ASCII_Boolean","0","1","Unbounded","Unbounded","Unbounded","Unbounded","Units_of_None","none","TBD_classConcept","BOOLEAN"
"img:Autoexposure:2                   img:processing_venue:1              ","Attribute","processing_venue","n/a","img","The processing_venue attribute specifies where the processing described by the parent class was performed. ","img","ASCII_Short_String_Collapsed","0","1","Unbounded","Unbounded","1","255","Units_of_None","none","TBD_classConcept","SHORT_STRING"
"img:Autoexposure:2                   img:processing_algorithm:1          ","Attribute","processing_algorithm","n/a","img","The processing_algorithm attribute specifies the name of the algorithm used to perform the processing specified by the enclosing class. Algorithm names should be defined in the project documentation, and/or in the enclosing class definition. ","img","ASCII_Short_String_Collapsed","0","1","Unbounded","Unbounded","1","255","Units_of_None","none","TBD_classConcept","SHORT_STRING"
"img:Autoexposure:2                   img:sequence_number:1               ","Attribute","sequence_number","n/a","img","The sequence_number attribute supplies the sequence identifier for the associated value in a group of related values. ","img","ASCII_Short_String_Collapsed","0","1","Unbounded","Unbounded","1","255","Units_of_None","none","TBD_classConcept","SHORT_STRING"
"img:Brightness_Correction:1         ","Class","Brightness_Correction","1.0.0.0","img","The Brightness_Correction class describes brightness corrections that were applied to an image or mosaic. Brightness correction is the process of adjusting the DN values of adjacent frames in a mosaic so they match visually. It may also involve contrast or vignetting adjustments. The result may no longer be radiometrically calibrated due to the adjustments. The processing_algorithm child of Brightness_Correction describes the type of brightness correction, and should correspond to the classes within Brightness_Correction_Image. If the algorithm is "MIXED", multiple algorithms were used, in which case the specific information in each Brightness_Correction_Image must be used.","img","","","","","","","","","","",""
"img:Brightness_Correction:2          img:active_flag:1                   ","Attribute","active_flag","n/a","img","The active_flag attribute indicates whether or not the data processing described by the parent class is active. In general, the presence of the parent class implies it is active and thus active_flag is optional. The primary purpose for active_flag is to either explicitly indicate a correction is not active (for example, if it normally is but was explicitly turned off), or to be able to provide parameters for historical reasons that may no longer be relevant to a current correction. ","img","ASCII_Boolean","0","1","Unbounded","Unbounded","Unbounded","Unbounded","Units_of_None","none","TBD_classConcept","BOOLEAN"
"img:Brightness_Correction:2          img:processing_venue:1              ","Attribute","processing_venue","n/a","img","The processing_venue attribute specifies where the processing described by the parent class was performed. ","img","ASCII_Short_String_Collapsed","0","1","Unbounded","Unbounded","1","255","Units_of_None","none","TBD_classConcept","SHORT_STRING"
"img:Brightness_Correction:2          img:processing_algorithm:1          ","Attribute","processing_algorithm","n/a","img","The processing_algorithm attribute specifies the name of the algorithm used to perform the processing specified by the enclosing class. Algorithm names should be defined in the project documentation, and/or in the enclosing class definition. ","img","ASCII_Short_String_Collapsed","0","1","Unbounded","Unbounded","1","255","Units_of_None","none","TBD_classConcept","SHORT_STRING"
"img:Brightness_Correction:2          img:sequence_number:1               ","Attribute","sequence_number","n/a","img","The sequence_number attribute supplies the sequence identifier for the associated value in a group of related values. ","img","ASCII_Short_String_Collapsed","0","1","Unbounded","Unbounded","1","255","Units_of_None","none","TBD_classConcept","SHORT_STRING"
"img:Brightness_Correction_File:1    ","Class","Brightness_Correction_File","1.0.0.0","img","The Brightness_Correction_File identifies a file containing brightness correction information. The project SIS should define the format of this file. Correction information may appear in the file, in instances of the Brightness_Correction_Image class, or both (if both, they should be consistent).","img","","","","","","","","","","",""
"img:Brightness_Correction_File:2     pds:description:1                   ","Attribute","description","n/a","pds","The description attribute provides a statement, picture in words, or account that describes or is otherwise relevant to the object.","pds","UTF8_Text_Preserved","0","1","Unbounded","Unbounded","1","Unbounded","Units_of_None","none","TBD_classConcept","TBD_dataConcept"
"img:Brightness_Correction_File:2     pds:name:1                          ","Attribute","name","n/a","pds","The name attribute provides a word or combination of words by which the object is known.","pds","UTF8_Short_String_Collapsed","0","1","Unbounded","Unbounded","1","255","Units_of_None","none","TBD_classConcept","TBD_dataConcept"
"img:Brightness_Correction_Image:1   ","Class","Brightness_Correction_Image","1.0.0.0","img","The Brighness_Correction_Image class describes the brightness correction that was applied to a single image, whether alone or part of a mosaic. The image this correction applies to may be identified via the enclosed Internal_Reference, or via the order in which the Brightness_Correction_Image objects appear (which matches the order given in Input_Product_List).","img","","","","","","","","","","",""
"img:Brightness_Correction_HSI_Linear:1","Class","Brightness_Correction_HSI_Linear","1.0.0.0","img","The Brightness_Correction_HSI_Linear class works just like Brightness_Correction_Linear, except that the color image is first converted to HSI (Hue, Saturation, Intensity) space, the correction is applied only to Intensity, and then the result is converted back to RGB space.","img","","","","","","","","","","",""
"img:Brightness_Correction_HSI_Linear:2 img:brightness_scale:1              ","Attribute","brightness_scale","n/a","img","The brightness_scale attribute defines the multiplicative factor used for a linear brightness correction.","img","ASCII_Real","1","1","-1.7976931348623157e308","1.7976931348623157e308","Unbounded","Unbounded","Units_of_None","none","TBD_classConcept","REAL"
"img:Brightness_Correction_HSI_Linear:2 img:brightness_offset:1             ","Attribute","brightness_offset","n/a","img","The brightness_offset attribute defines the additive factor used for a linear brightness correction.","img","ASCII_Real","1","1","-1.7976931348623157e308","1.7976931348623157e308","Unbounded","Unbounded","Units_of_None","none","TBD_classConcept","REAL"
"img:Brightness_Correction_Linear:1  ","Class","Brightness_Correction_Linear","1.0.0.0","img","The Brightness_Correction_Linear class describes a simple linear brightness correction, with an additive (brightness_offset) and multiplicative (brightness_scale) factor applied. The result is: output = input * brightness_scale + brightness_offset. If there are multiple bands, the same correction is applied to each band.","img","","","","","","","","","","",""
"img:Brightness_Correction_Linear:2   img:brightness_scale:1              ","Attribute","brightness_scale","n/a","img","The brightness_scale attribute defines the multiplicative factor used for a linear brightness correction.","img","ASCII_Real","1","1","-1.7976931348623157e308","1.7976931348623157e308","Unbounded","Unbounded","Units_of_None","none","TBD_classConcept","REAL"
"img:Brightness_Correction_Linear:2   img:brightness_offset:1             ","Attribute","brightness_offset","n/a","img","The brightness_offset attribute defines the additive factor used for a linear brightness correction.","img","ASCII_Real","1","1","-1.7976931348623157e308","1.7976931348623157e308","Unbounded","Unbounded","Units_of_None","none","TBD_classConcept","REAL"
"img:Color_Filter_Array:1            ","Class","Color_Filter_Array","1.0.0.0","img","The Color_Filter_Array class describes whether or not an image was acquired using a Color Filter Array (CFA) and if so, whether and how the CFA pattern was removed. A CFA is a method for making color images using one exposure on a single sensor plane, where microfilters of different wavelengths are put in front of pixels in a specific pattern. The most common pattern is the Bayer pattern, which has a red, blue, and two green pixels in every 2x2 pixel square. Although generally used for RGB color, CFA filters can be of any number and wavelength (see color_filter_array_type).","img","","","","","","","","","","",""
"img:Color_Filter_Array:2             img:color_filter_array_type:1       ","Attribute","color_filter_array_type","n/a","img","Defines the type of Color Filter Array (CFA) used to encode multiple colors in a single exposure. The most common example of this is the Bayer pattern. This is optional if there is no CFA. Additional attributes, specific to each CFA type, define whether or not the CFA pattern has been removed, and if so, how (e.g. bayer_algorithm).","img","ASCII_Short_String_Collapsed","0","1","Unbounded","Unbounded","1","255","Units_of_None","none","TBD_classConcept","SHORT_STRING"
"img:Color_Filter_Array:2             img:color_filter_array_state:1      ","Attribute","color_filter_array_state","n/a","img","Specifies whether the image still has a CFA pattern ("Encoded"), the CFA pattern has been removed ("Decoded") or it never had a pattern ("No CFA").","img","ASCII_Short_String_Collapsed","0","1","Unbounded","Unbounded","1","255","Units_of_None","none","TBD_classConcept","SHORT_STRING"
"img:Color_Filter_Array:2             img:active_flag:1                   ","Attribute","active_flag","n/a","img","The active_flag attribute indicates whether or not the data processing described by the parent class is active. In general, the presence of the parent class implies it is active and thus active_flag is optional. The primary purpose for active_flag is to either explicitly indicate a correction is not active (for example, if it normally is but was explicitly turned off), or to be able to provide parameters for historical reasons that may no longer be relevant to a current correction. ","img","ASCII_Boolean","0","1","Unbounded","Unbounded","Unbounded","Unbounded","Units_of_None","none","TBD_classConcept","BOOLEAN"
"img:Color_Filter_Array:2             img:processing_venue:1              ","Attribute","processing_venue","n/a","img","The processing_venue attribute specifies where the processing described by the parent class was performed. ","img","ASCII_Short_String_Collapsed","0","1","Unbounded","Unbounded","1","255","Units_of_None","none","TBD_classConcept","SHORT_STRING"
"img:Color_Filter_Array:2             img:processing_algorithm:1          ","Attribute","processing_algorithm","n/a","img","The processing_algorithm attribute specifies the name of the algorithm used to perform the processing specified by the enclosing class. Algorithm names should be defined in the project documentation, and/or in the enclosing class definition. ","img","ASCII_Short_String_Collapsed","0","1","Unbounded","Unbounded","1","255","Units_of_None","none","TBD_classConcept","SHORT_STRING"
"img:Color_Filter_Array:2             img:sequence_number:1               ","Attribute","sequence_number","n/a","img","The sequence_number attribute supplies the sequence identifier for the associated value in a group of related values. ","img","ASCII_Short_String_Collapsed","0","1","Unbounded","Unbounded","1","255","Units_of_None","none","TBD_classConcept","SHORT_STRING"
"img:Color_Processing:1              ","Class","Color_Processing","1.0.0.0","img","The Color_Processing class contains parameters describing color correction or processing and how the image is represented in color.","img","","","","","","","","","","",""
"img:Color_Processing:2               img:color_space:1                   ","Attribute","color_space","n/a","img","Defines the color space in which this product is expressed. Some color spaces (e.g. XYZ or xyY) are independent of illuminant, while for others (e.g. sRGB or pRGB) the illuminant matters. It is expected that the defined color spaces will increase over time.","img","ASCII_Short_String_Collapsed","0","1","Unbounded","Unbounded","1","255","Units_of_None","none","TBD_classConcept","SHORT_STRING"
"img:Color_Processing:2               img:color_component:1               ","Attribute","color_component","n/a","img","For single-band images, this defines which component of the color space is represented by this band. This keyword is not needed for 3-band images, as all bands are represented.","img","ASCII_Short_String_Collapsed","0","1","Unbounded","Unbounded","1","255","Units_of_None","none","TBD_classConcept","SHORT_STRING"
"img:Color_Processing:2               img:illuminant:1                    ","Attribute","illuminant","n/a","img","Defines the illuminant that was used in order to process this image. The valid values are open-ended but examples of valid values include: None, D65, 3000K, 5000K.","img","ASCII_Short_String_Collapsed","0","1","Unbounded","Unbounded","1","255","Units_of_None","none","TBD_classConcept","SHORT_STRING"
"img:Color_Processing:2               img:encoded_display_gamma:1         ","Attribute","encoded_display_gamma","n/a","img","Defines the gamma value encoded in this image. Gamma correction is used to nonlinearly compress the intensities in an image, and most display systems assume that images are encoded with an sRGB gamma. Note that this is a string value because the most common gamma correction ("sRGB") is not precisely expressible as a gamma exponent. A numeric value indicates a gamma exponent.","img","ASCII_Short_String_Collapsed","0","1","Unbounded","Unbounded","1","255","Units_of_None","none","TBD_classConcept","SHORT_STRING"
"img:Color_Processing:2               img:color_dn_scaling_method:1       ","Attribute","color_dn_scaling_method","n/a","img","The color_dn_scaling_method attribute defines how the color values are scaled. EXPOSURE_NORMALIZED_COLOR means that the color values have been normalized based on exposure time, so neighboring images in a mosaic will have the same color values. DN_COLOR means that the color values are based on the raw DNs, so images take full advantage of the available dynamic range but may not match with neighbors in a mosaic.","img","ASCII_Short_String_Collapsed","0","1","Unbounded","Unbounded","1","255","Units_of_None","none","TBD_classConcept","SHORT_STRING"
"img:Color_Processing:2               img:color_dn_scaling_factor:1       ","Attribute","color_dn_scaling_factor","n/a","img","The color_dn_scaling_factor attribute specifies the actual value used to scale the color values. This value is determined using the color_dn_scaling_method.","img","ASCII_Real","0","1","-1.7976931348623157e308","1.7976931348623157e308","Unbounded","Unbounded","Units_of_None","none","TBD_classConcept","REAL"
"img:Color_Processing:2               img:active_flag:1                   ","Attribute","active_flag","n/a","img","The active_flag attribute indicates whether or not the data processing described by the parent class is active. In general, the presence of the parent class implies it is active and thus active_flag is optional. The primary purpose for active_flag is to either explicitly indicate a correction is not active (for example, if it normally is but was explicitly turned off), or to be able to provide parameters for historical reasons that may no longer be relevant to a current correction. ","img","ASCII_Boolean","0","1","Unbounded","Unbounded","Unbounded","Unbounded","Units_of_None","none","TBD_classConcept","BOOLEAN"
"img:Color_Processing:2               img:processing_venue:1              ","Attribute","processing_venue","n/a","img","The processing_venue attribute specifies where the processing described by the parent class was performed. ","img","ASCII_Short_String_Collapsed","0","1","Unbounded","Unbounded","1","255","Units_of_None","none","TBD_classConcept","SHORT_STRING"
"img:Color_Processing:2               img:processing_algorithm:1          ","Attribute","processing_algorithm","n/a","img","The processing_algorithm attribute specifies the name of the algorithm used to perform the processing specified by the enclosing class. Algorithm names should be defined in the project documentation, and/or in the enclosing class definition. ","img","ASCII_Short_String_Collapsed","0","1","Unbounded","Unbounded","1","255","Units_of_None","none","TBD_classConcept","SHORT_STRING"
