"img:Pointing_Correction_Image:2      img:pointing_model_name:1           ","Attribute","pointing_model_name","n/a","img","The pointing_model_name attribute specifies which of several "pointing models" were used to transform the camera model based on updated pointing information. These updates are typically derived from mosaic seam corrections. This attribute and the associated Pointing_Model_Index classes define what the updated pointing information is, providing enough information to re-create the camera model from calibration data. If present, this attribute overrides the default pointing based on telemetry. The special value "NONE" shall be interpreted the same as if the attribute is absent (i.e. the default pointing model should be used). New model names can be created at any time; the models themselves should be described in a mission-specific ancillary file. See also the geom:solution_id attribute within the geom:Camera_Model_Parameters class.","img","ASCII_Short_String_Collapsed","1","1","Unbounded","Unbounded","1","255","Units_of_None","none","TBD_classConcept","SHORT_STRING"
"img:Pointing_Correction_Image:2      img:pointing_model_solution_id:1    ","Attribute","pointing_model_solution_id","n/a","img","The pointing_model_solution_id attribute specifies the identifier of the pointing correction solution used to derive the model specified via the enclosing Pointing_Correction class. This identifier should also appear in the pointing correction file referenced by the Data_Correction_File. If there is only one identifier in the correction file, then pointing_model_solution_id may be omitted. The pointing_model_solution_id attribute may be reused in the context of pointing corrections, although uniqueness is recommended. The pointing correction solution ID namespace is separate from the coordinate system namespace.","img","ASCII_Short_String_Collapsed","0","1","Unbounded","Unbounded","1","255","Units_of_None","none","TBD_classConcept","SHORT_STRING"
"img:Pointing_Model_Parameter:1      ","Class","Pointing_Model_Parameter","1.0.0.0","img","The Pointing_Model_Parameter class specifies the name and value (numeric) parameters needed by the pointing model identified by the pointing_model_name attribute in the Pointing_Correction parent class. The meaning of any given parameter is defined by the pointing model. ","img","","","","","","","","","","",""
"img:Pointing_Model_Parameter:2       pds:name:1                          ","Attribute","name","n/a","pds","The name attribute provides a word or combination of words by which the object is known.","pds","UTF8_Short_String_Collapsed","1","1","Unbounded","Unbounded","1","255","Units_of_None","none","TBD_classConcept","TBD_dataConcept"
"img:Pointing_Model_Parameter:2       pds:value:1                         ","Attribute","value","n/a","pds","The value attribute provides a single, allowed numerical or character string value.","pds","ASCII_Short_String_Collapsed","1","1","Unbounded","Unbounded","1","255","Units_of_None","none","TBD_classConcept","TBD_dataConcept"
"img:Radial_Flat_Field_Function:1    ","Class","Radial_Flat_Field_Function","1.0.0.0","img","The Radial_Flat_Field_Function class pecifies parameters used to generate a synthetic flat field using a simple radial function of the form: r = (x-x_center)^2 + (y-y_center)^2 ; flat_field(x,y) = 1 + r0 + r1*r + r2*r^2 + r3*r^3 . Note that x is in the sample direction of the image, and y is in the line direction. The image is multiplied by this function in order to perform a flat field correction (which is the opposite of Flat_Field_File). ","img","","","","","","","","","","",""
"img:Radial_Flat_Field_Function:2     img:x_center:1                      ","Attribute","x_center","n/a","img","The x_center attribute specifies the sample coordinate of the center of the function used to describe an algorithmic flat field. See Radial_Flat_Field_Function for the formula.","img","ASCII_Real","0","1","-1.7976931348623157e308","1.7976931348623157e308","Unbounded","Unbounded","Units_of_Misc","none","TBD_classConcept","REAL"
"img:Radial_Flat_Field_Function:2     img:y_center:1                      ","Attribute","y_center","n/a","img","The y_center attribute specifies the line coordinate of the center of the function used to describe an algorithmic flat field. See Radial_Flat_Field_Function for the formula.","img","ASCII_Real","0","1","-1.7976931348623157e308","1.7976931348623157e308","Unbounded","Unbounded","Units_of_Misc","none","TBD_classConcept","REAL"
"img:Radial_Flat_Field_Function:2     img:r0:1                            ","Attribute","r0","n/a","img","The r0 attribute specifies the 0th-order polynomial coefficient of the function used to describe an algorithmic flat field. See Radial_Flat_Field_Function for the formula.","img","ASCII_Real","0","1","-1.7976931348623157e308","1.7976931348623157e308","Unbounded","Unbounded","Units_of_None","none","TBD_classConcept","REAL"
"img:Radial_Flat_Field_Function:2     img:r1:1                            ","Attribute","r1","n/a","img","The r1 attribute specifies the 1st-order polynomial coefficient of the function used to describe an algorithmic flat field. See Radial_Flat_Field_Function for the formula.","img","ASCII_Real","0","1","-1.7976931348623157e308","1.7976931348623157e308","Unbounded","Unbounded","Units_of_None","none","TBD_classConcept","REAL"
"img:Radial_Flat_Field_Function:2     img:r2:1                            ","Attribute","r2","n/a","img","The r2 attribute specifies the 2nd-order polynomial coefficient of the function used to describe an algorithmic flat field. See Radial_Flat_Field_Function for the formula.","img","ASCII_Real","0","1","-1.7976931348623157e308","1.7976931348623157e308","Unbounded","Unbounded","Units_of_None","none","TBD_classConcept","REAL"
"img:Radial_Flat_Field_Function:2     img:r3:1                            ","Attribute","r3","n/a","img","The r3 attribute specifies specifies the 3rd-order polynomial coefficient of the function used to describe an algorithmic flat field. See Radial_Flat_Field_Function for the formula.","img","ASCII_Real","0","1","-1.7976931348623157e308","1.7976931348623157e308","Unbounded","Unbounded","Units_of_None","none","TBD_classConcept","REAL"
"img:Radiometric_Correction:1        ","Class","Radiometric_Correction","1.0.0.0","img"," The Radiometric_Correction class is a container for the type and details of the radiometric calibration performed on the product.","img","","","","","","","","","","",""
"img:Radiometric_Correction:2         img:radiometric_type:1              ","Attribute","radiometric_type","n/a","img","The radiometric_type defines the specific type of radiance measurement. Possible values include "Radiance", "Spectral Radiance", "Scaled Spectral Radiance". Note: There are many more possible values, and this definition can be updated to include more examples over time. ","img","ASCII_Short_String_Collapsed","0","1","Unbounded","Unbounded","1","255","Units_of_None","none","TBD_classConcept","SHORT_STRING"
"img:Radiometric_Correction:2         img:radiometric_zenith_scaling_factor:1","Attribute","radiometric_zenith_scaling_factor","n/a","img","Defines the scaling factor used for Scaled Radiance or Scaled Spectral Radiance. Scaled radiance is created by dividing radiance by this factor, which scales the radiance to what it would be if the sun were at the zenith with a clear atmosphere.","img","ASCII_Real","0","1","-1.7976931348623157e308","1.7976931348623157e308","Unbounded","Unbounded","Units_of_None","none","TBD_classConcept","REAL"
"img:Radiometric_Correction:2         img:responsivity_r:1                ","Attribute","responsivity_r","n/a","img","Specifies the conversion factor between DN and radiance units that has been applied to the red channel of an image.","img","ASCII_Real","0","1","-1.7976931348623157e308","1.7976931348623157e308","Unbounded","Unbounded","Units_of_None","none","TBD_classConcept","REAL"
"img:Radiometric_Correction:2         img:responsivity_g:1                ","Attribute","responsivity_g","n/a","img","Specifies the conversion factor between DN and radiance units that has been applied to the green channel of an image.","img","ASCII_Real","0","1","-1.7976931348623157e308","1.7976931348623157e308","Unbounded","Unbounded","Units_of_None","none","TBD_classConcept","REAL"
"img:Radiometric_Correction:2         img:responsivity_b:1                ","Attribute","responsivity_b","n/a","img","Specifies the conversion factor between DN and radiance units that has been applied to the blue channel of an image.","img","ASCII_Real","0","1","-1.7976931348623157e308","1.7976931348623157e308","Unbounded","Unbounded","Units_of_None","none","TBD_classConcept","REAL"
"img:Radiometric_Correction:2         img:responsivity_pan:1              ","Attribute","responsivity_pan","n/a","img","Specifies the conversion factor between DN and radiance units that has been applied to a panchromatic image.","img","ASCII_Real","0","1","-1.7976931348623157e308","1.7976931348623157e308","Unbounded","Unbounded","Units_of_None","none","TBD_classConcept","REAL"
"img:Radiometric_Correction:2         img:atmospheric_opacity:1           ","Attribute","atmospheric_opacity","n/a","img","The atmospheric opacity (tau) value used in radiometric correction.","img","ASCII_Real","0","1","-1.7976931348623157e308","1.7976931348623157e308","Unbounded","Unbounded","Units_of_None","none","TBD_classConcept","REAL"
"img:Radiometric_Correction:2         img:atmospheric_opacity_reference:1 ","Attribute","atmospheric_opacity_reference","n/a","img","The atmospheric opacity (tau) target value to which the image was corrected.","img","ASCII_Real","0","1","-1.7976931348623157e308","1.7976931348623157e308","Unbounded","Unbounded","Units_of_None","none","TBD_classConcept","REAL"
"img:Radiometric_Correction:2         pds:comment:1                       ","Attribute","comment","n/a","pds","The comment attribute is a character string expressing one or more remarks or thoughts relevant to the object.","pds","ASCII_Short_String_Collapsed","0","1","Unbounded","Unbounded","1","255","Units_of_None","none","TBD_classConcept","TBD_dataConcept"
"img:Radiometric_Correction:2         img:active_flag:1                   ","Attribute","active_flag","n/a","img","The active_flag attribute indicates whether or not the data processing described by the parent class is active. In general, the presence of the parent class implies it is active and thus active_flag is optional. The primary purpose for active_flag is to either explicitly indicate a correction is not active (for example, if it normally is but was explicitly turned off), or to be able to provide parameters for historical reasons that may no longer be relevant to a current correction. ","img","ASCII_Boolean","0","1","Unbounded","Unbounded","Unbounded","Unbounded","Units_of_None","none","TBD_classConcept","BOOLEAN"
"img:Radiometric_Correction:2         img:processing_venue:1              ","Attribute","processing_venue","n/a","img","The processing_venue attribute specifies where the processing described by the parent class was performed. ","img","ASCII_Short_String_Collapsed","0","1","Unbounded","Unbounded","1","255","Units_of_None","none","TBD_classConcept","SHORT_STRING"
"img:Radiometric_Correction:2         img:processing_algorithm:1          ","Attribute","processing_algorithm","n/a","img","The processing_algorithm attribute specifies the name of the algorithm used to perform the processing specified by the enclosing class. Algorithm names should be defined in the project documentation, and/or in the enclosing class definition. ","img","ASCII_Short_String_Collapsed","0","1","Unbounded","Unbounded","1","255","Units_of_None","none","TBD_classConcept","SHORT_STRING"
"img:Radiometric_Correction:2         img:sequence_number:1               ","Attribute","sequence_number","n/a","img","The sequence_number attribute supplies the sequence identifier for the associated value in a group of related values. ","img","ASCII_Short_String_Collapsed","0","1","Unbounded","Unbounded","1","255","Units_of_None","none","TBD_classConcept","SHORT_STRING"
"img:Reference_Pixel:1               ","Class","Reference_Pixel","1.0.0.0","img","Describes a Reference Pixel product, which is a set of dark, non-imaging pixels used to monitor electronics. product_flag.","img","","","","","","","","","","",""
"img:Reference_Pixel:2                img:product_flag:1                  ","Attribute","product_flag","n/a","img","Indicates whether the product in the enclosing class was requested for downlink (when in Commanded_Parameters), or whether this product actually is the type in question (when in Imaging). For example, Commanded_Parameters.Histogram.product_flag = true indicates that a histogram was requested as part of the command that created the data product being labeled, while Imaging.Histogram.product_flag = true indicates that this data product itself is (or contains) a histogram.","img","ASCII_Boolean","0","1","Unbounded","Unbounded","Unbounded","Unbounded","Units_of_None","none","TBD_classConcept","BOOLEAN"
"img:Reference_Pixel:2                img:download_priority:1             ","Attribute","download_priority","n/a","img","The download_priority attribute specifies which data to downlink/transmit, based on order of importance. The ranking and meaning of specific values will vary depending on the mission, and should be defined in the mission software interface specification (SIS).","img","ASCII_NonNegative_Integer","0","1","0","18446744073709551615","Unbounded","Unbounded","Units_of_None","none","TBD_classConcept","INTEGER"
"img:Histogram:1                     ","Class","Histogram","1.0.0.0","img","Describes a Histogram product.","img","","","","","","","","","","",""
"img:Histogram:2                      img:product_flag:1                  ","Attribute","product_flag","n/a","img","Indicates whether the product in the enclosing class was requested for downlink (when in Commanded_Parameters), or whether this product actually is the type in question (when in Imaging). For example, Commanded_Parameters.Histogram.product_flag = true indicates that a histogram was requested as part of the command that created the data product being labeled, while Imaging.Histogram.product_flag = true indicates that this data product itself is (or contains) a histogram.","img","ASCII_Boolean","0","1","Unbounded","Unbounded","Unbounded","Unbounded","Units_of_None","none","TBD_classConcept","BOOLEAN"
"img:Histogram:2                      img:download_priority:1             ","Attribute","download_priority","n/a","img","The download_priority attribute specifies which data to downlink/transmit, based on order of importance. The ranking and meaning of specific values will vary depending on the mission, and should be defined in the mission software interface specification (SIS).","img","ASCII_NonNegative_Integer","0","1","0","18446744073709551615","Unbounded","Unbounded","Units_of_None","none","TBD_classConcept","INTEGER"
"img:Col_Sum:1                       ","Class","Col_Sum","1.0.0.0","img","Describes a Column Summation product, which is a single row containing the sum of all pixels in each column of the image.","img","","","","","","","","","","",""
"img:Col_Sum:2                        img:product_flag:1                  ","Attribute","product_flag","n/a","img","Indicates whether the product in the enclosing class was requested for downlink (when in Commanded_Parameters), or whether this product actually is the type in question (when in Imaging). For example, Commanded_Parameters.Histogram.product_flag = true indicates that a histogram was requested as part of the command that created the data product being labeled, while Imaging.Histogram.product_flag = true indicates that this data product itself is (or contains) a histogram.","img","ASCII_Boolean","0","1","Unbounded","Unbounded","Unbounded","Unbounded","Units_of_None","none","TBD_classConcept","BOOLEAN"
"img:Col_Sum:2                        img:download_priority:1             ","Attribute","download_priority","n/a","img","The download_priority attribute specifies which data to downlink/transmit, based on order of importance. The ranking and meaning of specific values will vary depending on the mission, and should be defined in the mission software interface specification (SIS).","img","ASCII_NonNegative_Integer","0","1","0","18446744073709551615","Unbounded","Unbounded","Units_of_None","none","TBD_classConcept","INTEGER"
"img:Row_Sum:1                       ","Class","Row_Sum","1.0.0.0","img","Describes a Row Summation product, which is a single column containing the sum of all pixels in each row of the image.","img","","","","","","","","","","",""
"img:Row_Sum:2                        img:product_flag:1                  ","Attribute","product_flag","n/a","img","Indicates whether the product in the enclosing class was requested for downlink (when in Commanded_Parameters), or whether this product actually is the type in question (when in Imaging). For example, Commanded_Parameters.Histogram.product_flag = true indicates that a histogram was requested as part of the command that created the data product being labeled, while Imaging.Histogram.product_flag = true indicates that this data product itself is (or contains) a histogram.","img","ASCII_Boolean","0","1","Unbounded","Unbounded","Unbounded","Unbounded","Units_of_None","none","TBD_classConcept","BOOLEAN"
"img:Row_Sum:2                        img:download_priority:1             ","Attribute","download_priority","n/a","img","The download_priority attribute specifies which data to downlink/transmit, based on order of importance. The ranking and meaning of specific values will vary depending on the mission, and should be defined in the mission software interface specification (SIS).","img","ASCII_NonNegative_Integer","0","1","0","18446744073709551615","Unbounded","Unbounded","Units_of_None","none","TBD_classConcept","INTEGER"
"img:Sampling:1                      ","Class","Sampling","1.0.0.0","img"," The Sampling class contains attributes and classes related to the sampling, scaling, companding, and compression or reduction in resolution of data.","img","","","","","","","","","","",""
"img:Sampling:2                       img:crosstrack_summing:1            ","Attribute","crosstrack_summing","n/a","img","The crosstrack_summing attribute provides the number of detector pixel values in the crosstrack direction that have been averaged to produce the final output pixel.","img","ASCII_NonNegative_Integer","0","1","1","18446744073709551615","Unbounded","Unbounded","Units_of_None","none","TBD_classConcept","INTEGER"
"img:Sampling:2                       img:downtrack_summing:1             ","Attribute","downtrack_summing","n/a","img","The downtrack_summing attribute provides the number of detector pixel values in the downtrack direction that have been averaged to produce the final output pixel.","img","ASCII_NonNegative_Integer","0","1","1","18446744073709551615","Unbounded","Unbounded","Units_of_None","none","TBD_classConcept","INTEGER"
"img:Sampling:2                       img:sample_bits:1                   ","Attribute","sample_bits","n/a","img","The sample_bits attribute specifies the logical or active number of bits in the data, which is distinct from the physical number of bits (for example, encoding 12-bit data within 16-bit words). These logical bits are stored in the low order (least significant) bits, with unused bits filled with 0 (or 1 for negative integers to preserve a two's complement representation). This is distinct from the valid data range (specified by valid_minimum and valid_maximum in Special_Constants class) because all values, including missing/invalid flag values, must fit within the sample_bits. The intent is that the data should be able to be sent through a communication channel that passes only sample_bits with no loss in fidelity.","img","ASCII_Short_String_Collapsed","0","1","Unbounded","Unbounded","1","255","Units_of_None","none","TBD_classConcept","SHORT_STRING"
"img:Sampling:2                       img:sample_bit_mask:1               ","Attribute","sample_bit_mask","n/a","img","The sample_bit_mask attribute Specifies the active bits in a sample. Any bit mask is valid in an non-raw product. Any 8-bit product, whether a scaled raw product or other, will have the value "2#11111111" and be stored in one byte. Any 12-bit product, whether an unscaled raw product, or an ILUT partially-processed product (see companding_method), will have the value "2#0000111111111111" and be stored in two bytes. A 15-bit product (e.g. Radiometrically-corrected Calibrated product type) will have the value "2#0111111111111111" and be stored in two bytes. Any 32-bit integer product (e.g. Histogram Raw product) will have the value "2#11111111111111111111111111111111" and be stored in four bytes. For floating-point data, sample_bit_mask is not valid and may be absent. If present, it should be ignored. NOTE: In the PDS, the domain of sample_bit_mask is dependent upon the currently-described value in the sample_bits attribute and only applies to integer values.","img","ASCII_Short_String_Collapsed","0","1","Unbounded","Unbounded","1","255","Units_of_None","none","TBD_classConcept","SHORT_STRING"
"img:Sampling:2                       img:sampling_factor:1               ","Attribute","sampling_factor","n/a","img"," The sampling_factor attribute provides the value N, where every Nth data point was kept from the original data set by selection, averaging, or taking the median. When applied to an image object, the single value represented in sampling_factor applies to both the lines and the samples.","img","ASCII_Short_String_Collapsed","0","1","Unbounded","Unbounded","1","255","Units_of_None","none","TBD_classConcept","SHORT_STRING"
"img:Sampling:2                       img:saturated_pixel_count:1         ","Attribute","saturated_pixel_count","n/a","img","The saturated_pixel_count attribute provides the number of pixels which were saturated. This can happen when the sensor acquired a value too low or too high to be measured accurately or if post-processing cause the output pixel value to fall below or above the the output range of valid values for the data or data type.","img","ASCII_NonNegative_Integer","0","1","0","18446744073709551615","Unbounded","Unbounded","Units_of_None","none","TBD_classConcept","INTEGER"
"img:Sampling:2                       img:missing_pixel_count:1           ","Attribute","missing_pixel_count","n/a","img"," The missing_pixel_count attribute identifies the total number of missing pixels defined by the image or image segment.","img","ASCII_NonNegative_Integer","0","1","0","18446744073709551615","Unbounded","Unbounded","Units_of_None","none","TBD_classConcept","INTEGER"
"img:Sampling:2                       img:valid_pixel_count:1             ","Attribute","valid_pixel_count","n/a","img","The valid_pixel_count attribute provides the total number of pixels tagged as valid. This will generally not include pixels flagged as saturated_pixel_count or missing_pixel_count.","img","ASCII_NonNegative_Integer","0","1","0","18446744073709551615","Unbounded","Unbounded","Units_of_None","none","TBD_classConcept","INTEGER"
"img:Shutter_Subtraction:1           ","Class","Shutter_Subtraction","1.0.0.0","img"," The Shutter_Subtraction class specifies attributes describing the removal from the image of the shutter, or fixed-pattern.","img","","","","","","","","","","",""
"img:Shutter_Subtraction:2            img:shutter_subtraction_mode:1      ","Attribute","shutter_subtraction_mode","n/a","img","The shutter_subtraction_mode specifies whether shutter subtraction will be performed, or if it is dependent on the exposure_duration_threshold_count.","img","ASCII_Short_String_Collapsed","0","1","Unbounded","Unbounded","1","255","Units_of_None","none","TBD_classConcept","SHORT_STRING"
"img:Shutter_Subtraction:2            img:exposure_duration_threshold_count:1","Attribute","exposure_duration_threshold_count","n/a","img","The exposure_duration_threshold specifies the exposure time threshold in raw counts, when shutter_subtraction_mode = 'Conditional'.","img","ASCII_Real","0","1","-1.7976931348623157e308","1.7976931348623157e308","Unbounded","Unbounded","Units_of_None","none","TBD_classConcept","REAL"
"img:Shutter_Subtraction:2            img:active_flag:1                   ","Attribute","active_flag","n/a","img","The active_flag attribute indicates whether or not the data processing described by the parent class is active. In general, the presence of the parent class implies it is active and thus active_flag is optional. The primary purpose for active_flag is to either explicitly indicate a correction is not active (for example, if it normally is but was explicitly turned off), or to be able to provide parameters for historical reasons that may no longer be relevant to a current correction. ","img","ASCII_Boolean","0","1","Unbounded","Unbounded","Unbounded","Unbounded","Units_of_None","none","TBD_classConcept","BOOLEAN"
"img:Shutter_Subtraction:2            img:processing_venue:1              ","Attribute","processing_venue","n/a","img","The processing_venue attribute specifies where the processing described by the parent class was performed. ","img","ASCII_Short_String_Collapsed","0","1","Unbounded","Unbounded","1","255","Units_of_None","none","TBD_classConcept","SHORT_STRING"
